Python Discord Hacktoberfest 2019!,0
What's everyone working on this week?,0
The only ghost from the past to be afraid of...,0
Using Robo Wunderkind to Create a Python Party Bot,0
3 Python packages for extracting text / data from Word Documents,1
Is there any reason to ever *not* use dataclasses when your __init__ is just loading data?,1
[Tutorial ] Create indian flag using turtle python,0
Python for Kids: A Playful Introduction to Programming By Jason R. Briggs PDF,0
Unexpected 3.7 to 3.8 upgrade,1
Struggling guys - New to coding and need some advice,0
My previous post on the algorithm i made to create these images blew up  so here is another! WITH a Github link: https://github.com/TyperOfCode/image_algorithm,0
Yo!! Guys can you please suggest me a few libraries for building simulations,0
how to display plotnine plot?,0
Assignment help!,0
n00b Question: Get Windows Logged In Display Name,0
Supercharge your Python testing workflow,1
Analyzing the 2019 Stack Overflow Developer Survey with Python,0
A clear step-by-step guide to train a model for Object Detection using Keras-Retinanet's implementation of Fast R-CNN model. (Dataset + pre-trained model included - Drone Detection As Example),1
Creating Jinja / Flask Help Creating Variables To Adjust Formatting and White Space,0
I made a command line password safe  can y'all review my code?,0
Double precision,0
How do you work with Excel files? (.csv  .xlsx  .xlsm),0
PipeFrame: a small pipeline library that help you process data (stream or batch) taking advantage of python multiprocessing library.,0
index out of bounds,0
Is something wrong with 3.8 pip install?,0
Basic Data Types in Python 3: Strings,1
Python3.8 difference to Python3.7,1
Import pandas,1
Hello all!,0
I created a tool that de clutters OSX desktops of screenshots!,0
Any advice for learning a lot of Python without spending time practicing it?,0
Best way to host jupyter notebook to share? Is Django possible ?,0
Python 3.8 for anaconda?,0
Loop (iterate) over JSON file,0
I created a simple ecosystem with a lot of fun. You can check it out at my GitHub. Feel free to contribute or share your ideas :),0
Assignment Help,0
scraping a page,0
Python Attribute Access and the Descriptor Protocol,0
Cool New Features in Python 3.8 – Real Python,1
if i have sorted the words in a list alphabetically then added them to a new list is there a way to turn them back to normal words?,0
Merging multiple data frames and add a new column to distinguish each data frame,1
how to dynamically change the name of variable using for loop,0
My midterm is coming up! Help!,0
Exploring Odoo Python: Benefits and Upgradations,0
[Tutorial] How To Create GUI Login And Signup System Using Python,1
David Beazley's Key note speech at Pycon India,0
How to update in PyMongo?,0
Simulation of Random movement of a Particle with python 70.000 particles,0
Multiprocessing vs. Threading in Python: What Every Data Scientist Needs to Know,1
Predicting NFL play outcomes with Python and data science,1
Is it possible to implement a method to support **kwarging?,0
Trade and Invest Smarter — The Reinforcement Learning Way,1
tailing a log on a remote server,0
Sympy/Numpy,0
xlwings-reports: Produce Excel and PDF reports in minutes  not hours. Connect to any data source with Python.,1
TreeT: Simple  minimal  but powerful tools to handle any kind of hierarchical (tree) structures,0
We’re #1,0
My Python Youtube channel just hit 10 000 subscribers - buildwithpython,0
TeleCraft - Send and recieve messages from any Telegram groups in Minecraft!,0
A Comprehensive and Easy to learn Guide on Python Logging,0
Python Lottery Game Help!,0
[P] PyCM 2.5 released : Multi-class confusion matrix library in Python,0
Is it possible to create an app to debug JSON and show where errors are?,0
How to completely remove Python 3.7.4 fro macOS?,0
I created a simple algo trading bot,0
What is the difference between converting python code to byte code and freezing the binaries?,0
Git For Dummies-A Beginner's Guide From A Beginner,0
Python - VPN Package,0
Divide And Conquer Algorithms In Python,0
Downloading pandas_datareader,0
What Does A Solid Python Development Stack Look Like?,0
META-PROGRAMMING IN PYTHON,0
Can anyone help me out to convert pdf to image using ghostscript.,0
Change Python code while it's running [GitHub],0
Python 3.8 & Anaconda,0
daudin - A Python command-line shell,0
I made a typing speed test,0
I reject your reality and substitute my own!,0
Questions about the Wulrus :=,0
After few hours . Particle simulation in Python,0
very basic python help :(,0
Researchers find bug in Python script may have affected hundreds of studies,0
Python Career Path - The next big thing is Python programming!,0
How to make an online marketplace app using Python?,0
Researchers find bug in Python script may have affected hundreds of studies | Ars Technica,0
I made my first Python script!,0
Socket programming project ideas,0
How to add an element to a list,0
I cracked 40 000 passwords with Python. Yours might have been one of them,0
Python sleep(): How to Add Time Delays to Your Code – Real Python,0
Python is one of the most popular programming languages on GitHub!,0
When Python Meets Fourier Transform,0
Looking for People with API Servers Wanting Help to Convert Into a SaaS Business,0
How should I design a software for a machine that runs deep leraning and generate actuatlions based on it?,0
GIS visualization toolchain,0
Anyone who has worked with Tornado web-framework? Want to hear the Experience!,0
Progress Bars in Python (and pandas!) - Peter Nistrup,1
How to Implement Switch Case in Python,0
Codecademy python course,0
How I went from C++ to Python: a conceptual change,0
Can anyone help me,0
Python Insider: Python 3.7.5 is now available,0